{
  "profile": "open5gs_nsa_lab_v1",
  "n2": {
    "amf_host": "10.41.83.45",
    "amf_port": 38412,
    "bind_host": "10.41.83.34"
  },
  "n3": {
    "upf_host": "10.41.83.45",
    "gtpu_port": 2152,
    "dnn": "internet",
    "slice": {
      "sst": 1,
      "sd": "000001"
    }
  },
  "subscriber_profile": {
    "imsi_ref": "sanitized-imsi-001",
    "ue_class": "n79_lab_ue"
  },
  "session_profile": {
    "pdu_type": "ipv4",
    "expect_ping_target": "8.8.8.8"
  }
}
